{
  "$schema": "http://json-schema.org/draft-07/schema#",
  "title": "associatedArmyLists",
  "description": "Meshwesh associatedArmyLists",
  "$id": "https://github.com/marcpawl/Triumph_TTS.git/$associatedArmyLists",
  "type": "array",
  "items": {
    "type": "object",
    "properties": {
      "keywords": {
        "type": "array",
        "items": {
          "type": "string"
        }
      },
      "derivedData": {
        "type": "object",
        "properties": {
          "listStartDate": {
            "type": "integer"
          },
          "listEndDate": {
            "type": "integer"
          },
          "extendedName": {
            "type": "string"
          }
        },
        "required": [
          "extendedName",
          "listEndDate",
          "listStartDate"
        ]
      },
      "sortId": {
        "type": "number"
      },
      "sublistId": {
        "type": "string"
      },
      "name": {
        "type": "string"
      },
      "invasionRatings": {
        "type": "array",
        "items": {
          "type": "object",
          "properties": {
            "_id": {
              "type": "string"
            },
            "value": {
              "type": "integer"
            },
            "note": {
              "type": [
                "null",
                "string"
              ]
            }
          },
          "required": [
            "_id",
            "note",
            "value"
          ]
        }
      },
      "maneuverRatings": {
        "type": "array",
        "items": {
          "type": "object",
          "properties": {
            "_id": {
              "type": "string"
            },
            "value": {
              "type": "integer"
            },
            "note": {
              "type": [
                "null",
                "string"
              ]
            }
          },
          "required": [
            "_id",
            "note",
            "value"
          ]
        }
      },
      "homeTopographies": {
        "type": "array",
        "items": {
          "type": "object",
          "properties": {
            "values": {
              "type": "array",
              "items": {
                "type": "string"
              }
            },
            "_id": {
              "type": "string"
            },
            "note": {
              "type": "string"
            }
          },
          "required": [
            "_id",
            "note",
            "values"
          ]
        }
      },
      "listId": {
        "type": "number"
      },
      "dateRanges": {
        "type": "array",
        "items": {
          "type": "object",
          "properties": {
            "_id": {
              "type": "string"
            },
            "startDate": {
              "type": "integer"
            },
            "endDate": {
              "type": "integer"
            }
          },
          "required": [
            "_id",
            "endDate",
            "startDate"
          ]
        }
      },
      "troopOptions": {
        "type": "array",
        "items": {
          "type": "object",
          "properties": {
            "_id": {
              "type": "string"
            },
            "min": {
              "type": "integer"
            },
            "max": {
              "type": "integer"
            },
            "dateRanges": {
              "type": "array",
              "items": {
                "type": "object",
                "properties": {
                  "_id": {
                    "type": "string"
                  },
                  "startDate": {
                    "type": "integer"
                  },
                  "endDate": {
                    "type": "integer"
                  }
                },
                "required": [
                  "_id",
                  "endDate",
                  "startDate"
                ]
              }
            },
            "troopEntries": {
              "type": "array",
              "items": {
                "type": "object",
                "properties": {
                  "_id": {
                    "type": "string"
                  },
                  "troopTypeCode": {
                    "type": "string"
                  },
                  "dismountTypeCode": {
                    "type": "null"
                  },
                  "note": {
                    "type": [
                      "null",
                      "string"
                    ]
                  }
                },
                "required": [
                  "_id",
                  "dismountTypeCode",
                  "note",
                  "troopTypeCode"
                ]
              }
            },
            "description": {
              "type": "string"
            },
            "note": {
              "type": "string"
            },
            "core": {
              "type": "string"
            },
            "battleCardEntries": {
              "type": "array",
              "items": {
                "type": "object",
                "properties": {
                  "_id": {
                    "type": "string"
                  },
                  "min": {
                    "type": [
                      "integer",
                      "null"
                    ]
                  },
                  "max": {
                    "type": [
                      "integer",
                      "null"
                    ]
                  },
                  "battleCardCode": {
                    "type": "string"
                  },
                  "note": {
                    "type": [
                      "null",
                      "string"
                    ]
                  }
                },
                "required": [
                  "_id",
                  "battleCardCode",
                  "max",
                  "min",
                  "note"
                ]
              }
            }
          },
          "required": [
            "_id",
            "battleCardEntries",
            "core",
            "dateRanges",
            "description",
            "max",
            "min",
            "note",
            "troopEntries"
          ]
        }
      },
      "troopEntriesForGeneral": {
        "type": "array",
        "items": {
          "type": "object",
          "properties": {
            "_id": {
              "type": "string"
            },
            "troopEntries": {
              "type": "array",
              "items": {
                "type": "object",
                "properties": {
                  "_id": {
                    "type": "string"
                  },
                  "troopTypeCode": {
                    "type": "string"
                  },
                  "dismountTypeCode": {
                    "type": "null"
                  },
                  "note": {
                    "type": [
                      "null",
                      "string"
                    ]
                  }
                },
                "required": [
                  "_id",
                  "dismountTypeCode",
                  "note",
                  "troopTypeCode"
                ]
              }
            }
          },
          "required": [
            "_id",
            "troopEntries"
          ]
        }
      },
      "allyOptions": {
        "type": "array",
        "items": {
          "type": "object",
          "properties": {
            "_id": {
              "type": "string"
            },
            "dateRange": {
              "anyOf": [
                {
                  "type": "null"
                },
                {
                  "type": "object",
                  "properties": {
                    "_id": {
                      "type": "string"
                    },
                    "startDate": {
                      "type": "integer"
                    },
                    "endDate": {
                      "type": "integer"
                    }
                  },
                  "required": [
                    "_id",
                    "endDate",
                    "startDate"
                  ]
                }
              ]
            },
            "note": {
              "type": "null"
            },
            "allyEntries": {
              "type": "array",
              "items": {
                "type": "object",
                "properties": {
                  "_id": {
                    "type": "string"
                  },
                  "name": {
                    "type": "string"
                  },
                  "allyArmyList": {
                    "type": "string"
                  }
                },
                "required": [
                  "_id",
                  "allyArmyList",
                  "name"
                ]
              }
            }
          },
          "required": [
            "_id",
            "allyEntries",
            "dateRange",
            "note"
          ]
        }
      },
      "battleCardEntries": {
        "type": "array",
        "items": {
          "type": "object",
          "properties": {
            "_id": {
              "type": "string"
            },
            "min": {
              "type": [
                "integer",
                "null"
              ]
            },
            "max": {
              "type": [
                "integer",
                "null"
              ]
            },
            "battleCardCode": {
              "type": "string"
            },
            "note": {
              "type": [
                "null",
                "string"
              ]
            }
          },
          "required": [
            "_id",
            "battleCardCode",
            "note"
          ]
        }
      },
      "showTroopOptionDescriptions": {
        "type": "boolean"
      },
      "status": {
        "type": "string"
      },
      "id": {
        "type": "string"
      }
    },
    "required": [
      "allyOptions",
      "battleCardEntries",
      "dateRanges",
      "derivedData",
      "homeTopographies",
      "id",
      "invasionRatings",
      "keywords",
      "listId",
      "maneuverRatings",
      "name",
      "showTroopOptionDescriptions",
      "sortId",
      "status",
      "sublistId",
      "troopEntriesForGeneral",
      "troopOptions"
    ]
  }
}