[{"keywords":["Italy"],"derivedData":{"listStartDate":-650,"listEndDate":-400,"extendedName":"Iron Age Italian  650 to 400 BC"},"sortId":51,"sublistId":"a","name":"Iron Age Italian","invasionRatings":[{"_id":"6153507403385c0016b81767","value":2,"note":null}],"maneuverRatings":[{"_id":"6153507403385c0016b81768","value":1,"note":"Etruscans"},{"_id":"6153507403385c0016b81769","value":0,"note":"All others"}],"homeTopographies":[{"values":["Arable"],"_id":"6153507403385c0016b8176a","note":""}],"listId":51,"dateRanges":[{"_id":"6153507403385c0016b8176b","startDate":-650,"endDate":-400}],"troopOptions":[{"_id":"615351a103385c0016b8553a","min":1,"max":2,"dateRanges":[],"troopEntries":[{"_id":"615351a103385c0016b8553b","troopTypeCode":"JCV","dismountTypeCode":null,"note":null}],"description":"Horsemen","note":"","core":"","battleCardEntries":[]},{"_id":"615351a103385c0016b8553c","min":6,"max":14,"dateRanges":[{"_id":"615351a103385c0016b8553d","startDate":0,"endDate":0}],"troopEntries":[{"_id":"615351a103385c0016b8553e","troopTypeCode":"HFT","dismountTypeCode":null,"note":null}],"description":"Hoplites and spearmen","note":"","core":"all","battleCardEntries":[]},{"_id":"615351a103385c0016b8553f","min":1,"max":3,"dateRanges":[],"troopEntries":[{"_id":"615351a103385c0016b85540","troopTypeCode":"RBL","dismountTypeCode":null,"note":null}],"description":"Javelinmen","note":"","core":"","battleCardEntries":[]},{"_id":"615351a103385c0016b85541","min":0,"max":2,"dateRanges":[],"troopEntries":[{"_id":"615351a103385c0016b85542","troopTypeCode":"SKM","dismountTypeCode":null,"note":null}],"description":"Skirmishing bowmen and slingers","note":"","core":"","battleCardEntries":[]}],"troopEntriesForGeneral":[{"_id":"615351a103385c0016b85543","troopEntries":[{"_id":"615351a103385c0016b85544","troopTypeCode":"JCV","dismountTypeCode":null,"note":null}]}],"allyOptions":[{"_id":"615351a103385c0016b85545","dateRange":{"_id":"615351a103385c0016b85546","startDate":-505,"endDate":-400},"note":null,"allyEntries":[{"_id":"615351a103385c0016b85547","name":"Latin Italiot allies","allyArmyList":"6153518f03385c0016b837c2"}]},{"_id":"615351a103385c0016b85548","dateRange":{"_id":"615351a103385c0016b85549","startDate":-505,"endDate":-400},"note":null,"allyEntries":[{"_id":"615351a103385c0016b8554a","name":"Latin Volsci allies","allyArmyList":"6153518f03385c0016b83765"}]}],"battleCardEntries":[],"showTroopOptionDescriptions":true,"status":"Revised","id":"5fb1b9dbe1af0600177094c4"},{"keywords":["Roman","Italy"],"derivedData":{"listStartDate":-399,"listEndDate":-338,"extendedName":"Latin  399 to 338 BC"},"sortId":51,"sublistId":"c","name":"Latin","invasionRatings":[{"_id":"6153507403385c0016b81774","value":2,"note":null}],"maneuverRatings":[{"_id":"6153507403385c0016b81775","value":2,"note":null}],"homeTopographies":[{"values":["Arable"],"_id":"6153507403385c0016b81776","note":""}],"listId":51,"dateRanges":[{"_id":"6153507403385c0016b81777","startDate":-399,"endDate":-338}],"troopOptions":[{"_id":"615351a103385c0016b85559","min":1,"max":2,"dateRanges":[],"troopEntries":[{"_id":"615351a103385c0016b8555a","troopTypeCode":"JCV","dismountTypeCode":null,"note":null}],"description":"Horsemen","note":"","core":"","battleCardEntries":[]},{"_id":"615351a103385c0016b8555b","min":2,"max":3,"dateRanges":[{"_id":"615351a103385c0016b8555c","startDate":0,"endDate":0}],"troopEntries":[{"_id":"615351a103385c0016b8555d","troopTypeCode":"EFT","dismountTypeCode":null,"note":null}],"description":"Triarii","note":"","core":"all","battleCardEntries":[{"_id":"615351a103385c0016b8555e","min":null,"max":null,"battleCardCode":"HL","note":null}]},{"_id":"615351a103385c0016b8555f","min":6,"max":12,"dateRanges":[{"_id":"615351a103385c0016b85560","startDate":0,"endDate":0}],"troopEntries":[{"_id":"615351a103385c0016b85561","troopTypeCode":"HFT","dismountTypeCode":null,"note":null}],"description":"Hastati, Principes","note":"","core":"all","battleCardEntries":[]},{"_id":"615351a103385c0016b85562","min":2,"max":3,"dateRanges":[{"_id":"615351a103385c0016b85563","startDate":0,"endDate":0}],"troopEntries":[{"_id":"615351a103385c0016b85564","troopTypeCode":"RBL","dismountTypeCode":null,"note":null}],"description":"Leves","note":"","core":"","battleCardEntries":[]},{"_id":"615351a103385c0016b85565","min":0,"max":2,"dateRanges":[],"troopEntries":[{"_id":"615351a103385c0016b85566","troopTypeCode":"SKM","dismountTypeCode":null,"note":null}],"description":"Skirmishing bowmen and slingers","note":"","core":"","battleCardEntries":[]}],"troopEntriesForGeneral":[{"_id":"615351a103385c0016b85567","troopEntries":[{"_id":"615351a103385c0016b85568","troopTypeCode":"JCV","dismountTypeCode":null,"note":null}]}],"allyOptions":[{"_id":"615351a103385c0016b85569","dateRange":null,"note":null,"allyEntries":[{"_id":"615351a103385c0016b8556a","name":"Campanian allies","allyArmyList":"6153519003385c0016b83835"}]},{"_id":"615351a103385c0016b8556b","dateRange":null,"note":null,"allyEntries":[{"_id":"615351a103385c0016b8556c","name":"Aurunci, Volsci, and/or Sidicini allies","allyArmyList":"6153518f03385c0016b83765"}]},{"_id":"615351a103385c0016b8556d","dateRange":null,"note":null,"allyEntries":[{"_id":"615351a103385c0016b8556e","name":"Syracusan allies","allyArmyList":"6153519003385c0016b83871"}]},{"_id":"615351a103385c0016b8556f","dateRange":{"_id":"615351a103385c0016b85570","startDate":-360,"endDate":-360},"note":null,"allyEntries":[{"_id":"615351a103385c0016b85571","name":"Gallic allies","allyArmyList":"6153519003385c0016b838dc"}]}],"battleCardEntries":[],"showTroopOptionDescriptions":true,"status":"Revised","id":"5fb1b9dbe1af0600177094d1"}]