[{"keywords":["Polynesian"],"derivedData":{"listStartDate":1320,"listEndDate":1785,"extendedName":"Maori  1320 to 1785 AD"},"sortId":360,"sublistId":"a","name":"Maori","invasionRatings":[{"_id":"6153508f03385c0016b826be","value":1,"note":null}],"maneuverRatings":[{"_id":"6153508f03385c0016b826bf","value":0,"note":null}],"homeTopographies":[{"values":["Forest"],"_id":"6153508f03385c0016b826c0","note":""}],"listId":351,"dateRanges":[{"_id":"6153508f03385c0016b826c1","startDate":1320,"endDate":1785}],"troopOptions":[{"_id":"615351b603385c0016b88e98","min":11,"max":12,"dateRanges":[],"troopEntries":[{"_id":"615351b603385c0016b88e99","troopTypeCode":"RDR","dismountTypeCode":null,"note":null}],"description":"Tribesmen","note":"","core":"all","battleCardEntries":[]}],"troopEntriesForGeneral":[{"_id":"615351b603385c0016b88e9a","troopEntries":[{"_id":"615351b603385c0016b88e9b","troopTypeCode":"RDR","dismountTypeCode":null,"note":null}]}],"allyOptions":[],"battleCardEntries":[{"_id":"615351b603385c0016b88e9c","min":null,"max":null,"battleCardCode":"FC","note":"Log palisade"}],"showTroopOptionDescriptions":true,"status":"Revised","id":"5fb1b9f6e1af06001770a446"},{"keywords":["Polynesian"],"derivedData":{"listStartDate":700,"listEndDate":1785,"extendedName":"Outer Polynesian  700 to 1785 AD"},"sortId":360,"sublistId":"b","name":"Outer Polynesian","invasionRatings":[{"_id":"6153508f03385c0016b826c4","value":1,"note":null}],"maneuverRatings":[{"_id":"6153508f03385c0016b826c5","value":0,"note":null}],"homeTopographies":[{"values":["Forest"],"_id":"6153508f03385c0016b826c6","note":""}],"listId":351,"dateRanges":[{"_id":"6153508f03385c0016b826c7","startDate":700,"endDate":1785}],"troopOptions":[{"_id":"615351b603385c0016b88e9d","min":10,"max":11,"dateRanges":[],"troopEntries":[{"_id":"615351b603385c0016b88e9e","troopTypeCode":"RDR","dismountTypeCode":null,"note":null}],"description":"Tribesmen","note":"","core":"all","battleCardEntries":[]},{"_id":"615351b603385c0016b88e9f","min":1,"max":2,"dateRanges":[],"troopEntries":[{"_id":"615351b603385c0016b88ea0","troopTypeCode":"SKM","dismountTypeCode":null,"note":null}],"description":"Skirmishing slingers","note":"","core":"","battleCardEntries":[]}],"troopEntriesForGeneral":[{"_id":"615351b603385c0016b88ea1","troopEntries":[{"_id":"615351b603385c0016b88ea2","troopTypeCode":"RDR","dismountTypeCode":null,"note":null}]}],"allyOptions":[],"battleCardEntries":[{"_id":"615351b603385c0016b88ea3","min":null,"max":null,"battleCardCode":"FC","note":"Log palisade"}],"showTroopOptionDescriptions":true,"status":"Revised","id":"5fb1b9f6e1af06001770a44c"},{"keywords":["Polynesian"],"derivedData":{"listStartDate":-800,"listEndDate":1785,"extendedName":"Central Polynesian  800 BC to 1785 AD"},"sortId":360,"sublistId":"c","name":"Central Polynesian","invasionRatings":[{"_id":"6153508f03385c0016b826ca","value":1,"note":null}],"maneuverRatings":[{"_id":"6153508f03385c0016b826cb","value":0,"note":null}],"homeTopographies":[{"values":["Forest"],"_id":"6153508f03385c0016b826cc","note":""}],"listId":351,"dateRanges":[{"_id":"6153508f03385c0016b826cd","startDate":-800,"endDate":1785}],"troopOptions":[{"_id":"615351b603385c0016b88ea4","min":14,"max":15,"dateRanges":[],"troopEntries":[{"_id":"615351b603385c0016b88ea5","troopTypeCode":"WBD","dismountTypeCode":null,"note":null}],"description":"Fierce tribesmen","note":"","core":"all","battleCardEntries":[]},{"_id":"615351b603385c0016b88ea6","min":1,"max":2,"dateRanges":[],"troopEntries":[{"_id":"615351b603385c0016b88ea7","troopTypeCode":"SKM","dismountTypeCode":null,"note":null}],"description":"Skirmishing bowmen and slingers","note":"","core":"","battleCardEntries":[]}],"troopEntriesForGeneral":[{"_id":"615351b603385c0016b88ea8","troopEntries":[{"_id":"615351b603385c0016b88ea9","troopTypeCode":"WBD","dismountTypeCode":null,"note":null}]}],"allyOptions":[],"battleCardEntries":[{"_id":"615351b603385c0016b88eaa","min":null,"max":null,"battleCardCode":"FC","note":"Log palisade"}],"showTroopOptionDescriptions":true,"status":"Revised","id":"5fb1b9f6e1af06001770a452"},{"keywords":["Polynesian"],"derivedData":{"listStartDate":-1200,"listEndDate":1785,"extendedName":"Melanesian  1200 BC to 1785 AD"},"sortId":360,"sublistId":"e","name":"Melanesian","invasionRatings":[{"_id":"6153508f03385c0016b826d6","value":1,"note":null}],"maneuverRatings":[{"_id":"6153508f03385c0016b826d7","value":0,"note":null}],"homeTopographies":[{"values":["Forest"],"_id":"6153508f03385c0016b826d8","note":""}],"listId":351,"dateRanges":[{"_id":"6153508f03385c0016b826d9","startDate":-1200,"endDate":1785}],"troopOptions":[{"_id":"615351b603385c0016b88eb8","min":13,"max":15,"dateRanges":[],"troopEntries":[{"_id":"615351b603385c0016b88eb9","troopTypeCode":"LFT","dismountTypeCode":null,"note":null}],"description":"Tribesmen","note":"","core":"all","battleCardEntries":[]},{"_id":"615351b603385c0016b88eba","min":1,"max":3,"dateRanges":[],"troopEntries":[{"_id":"615351b603385c0016b88ebb","troopTypeCode":"SKM","dismountTypeCode":null,"note":null}],"description":"Skirmishing bowmen and slingers","note":"","core":"","battleCardEntries":[]}],"troopEntriesForGeneral":[{"_id":"615351b603385c0016b88ebc","troopEntries":[{"_id":"615351b603385c0016b88ebd","troopTypeCode":"LFT","dismountTypeCode":null,"note":null}]}],"allyOptions":[],"battleCardEntries":[{"_id":"615351b603385c0016b88ebe","min":null,"max":null,"battleCardCode":"FC","note":"Log palisade"}],"showTroopOptionDescriptions":true,"status":"Revised","id":"5fb1b9f6e1af06001770a45e"}]