[{"keywords":[],"derivedData":{"listStartDate":-3000,"listEndDate":-2800,"extendedName":"Early Sumerian  3000 to 2800 BC"},"sortId":1,"sublistId":"a","name":"Early Sumerian","invasionRatings":[{"_id":"6153507203385c0016b81556","value":2,"note":null}],"maneuverRatings":[{"_id":"6153507203385c0016b81557","value":2,"note":null}],"homeTopographies":[{"values":["Delta"],"_id":"6153507203385c0016b81558","note":""}],"listId":1,"dateRanges":[{"_id":"6153507203385c0016b81559","startDate":-3000,"endDate":-2800}],"troopOptions":[{"_id":"6153519e03385c0016b84d91","min":1,"max":1,"dateRanges":[],"troopEntries":[{"_id":"6153519e03385c0016b84d92","troopTypeCode":"RDR","dismountTypeCode":null,"note":null}],"description":"Close-fighters","note":"","core":"all","battleCardEntries":[]},{"_id":"6153519e03385c0016b84d93","min":8,"max":20,"dateRanges":[],"troopEntries":[{"_id":"6153519e03385c0016b84d94","troopTypeCode":"BLV","dismountTypeCode":null,"note":null}],"description":"Household and militia bowmen","note":"","core":"","battleCardEntries":[]},{"_id":"6153519e03385c0016b84d95","min":1,"max":2,"dateRanges":[],"troopEntries":[{"_id":"6153519e03385c0016b84d96","troopTypeCode":"RBL","dismountTypeCode":null,"note":null}],"description":"Nomadic and levy javelinmen","note":"","core":"","battleCardEntries":[]},{"_id":"6153519e03385c0016b84d97","min":1,"max":6,"dateRanges":[],"troopEntries":[{"_id":"6153519e03385c0016b84d98","troopTypeCode":"SKM","dismountTypeCode":null,"note":null}],"description":"Nomadic and levy slingers and skirmishing bowmen","note":"","core":"","battleCardEntries":[]}],"troopEntriesForGeneral":[{"_id":"6153519e03385c0016b84d99","troopEntries":[{"_id":"6153519e03385c0016b84d9a","troopTypeCode":"RDR","dismountTypeCode":null,"note":null}]}],"allyOptions":[{"_id":"6153519e03385c0016b84d9b","dateRange":null,"note":null,"allyEntries":[{"_id":"6153519e03385c0016b84d9c","name":"Dry steppe nomad allies","allyArmyList":"6153518d03385c0016b834e1"}]},{"_id":"6153519e03385c0016b84d9d","dateRange":null,"note":null,"allyEntries":[{"_id":"6153519e03385c0016b84d9e","name":"Zagros Highlander allies","allyArmyList":"6153518d03385c0016b83529"}]},{"_id":"6153519e03385c0016b84d9f","dateRange":null,"note":null,"allyEntries":[{"_id":"6153519e03385c0016b84da0","name":"Elamite allies or vassals","allyArmyList":"6153518d03385c0016b834fa"}]}],"battleCardEntries":[{"_id":"6153519e03385c0016b84da1","min":null,"max":null,"battleCardCode":"PT","note":"pack donkeys"}],"showTroopOptionDescriptions":true,"status":"Revised","id":"5fb1b9d8e1af0600177092b3"},{"keywords":["Arab","Aramaean"],"derivedData":{"listStartDate":-3000,"listEndDate":-2001,"extendedName":"Nomadic Amurru  3000 to 2001 BC"},"sortId":7,"sublistId":"a","name":"Nomadic Amurru","invasionRatings":[{"_id":"6153507203385c0016b8158f","value":3,"note":null}],"maneuverRatings":[{"_id":"6153507203385c0016b81590","value":0,"note":null}],"homeTopographies":[{"values":["Dry"],"_id":"6153507203385c0016b81591","note":""}],"listId":7,"dateRanges":[{"_id":"6153507203385c0016b81592","startDate":-3000,"endDate":-2001}],"troopOptions":[{"_id":"6153519e03385c0016b84e8b","min":1,"max":6,"dateRanges":[],"troopEntries":[{"_id":"6153519e03385c0016b84e8c","troopTypeCode":"LFT","dismountTypeCode":null,"note":null}],"description":"Retainers and effective javelinmen","note":"","core":"all","battleCardEntries":[]},{"_id":"6153519e03385c0016b84e8d","min":6,"max":20,"dateRanges":[],"troopEntries":[{"_id":"6153519e03385c0016b84e8e","troopTypeCode":"RBL","dismountTypeCode":null,"note":null}],"description":"Unshielded javelinmen","note":"","core":"","battleCardEntries":[]},{"_id":"6153519e03385c0016b84e8f","min":1,"max":3,"dateRanges":[],"troopEntries":[{"_id":"6153519e03385c0016b84e90","troopTypeCode":"SKM","dismountTypeCode":null,"note":null}],"description":"Slingers","note":"","core":"","battleCardEntries":[]},{"_id":"6153519e03385c0016b84e91","min":1,"max":3,"dateRanges":[],"troopEntries":[{"_id":"6153519e03385c0016b84e92","troopTypeCode":"BLV","dismountTypeCode":null,"note":null},{"_id":"6153519e03385c0016b84e93","troopTypeCode":"ARC","dismountTypeCode":null,"note":null}],"description":"Bowmen","note":"","core":"all","battleCardEntries":[]}],"troopEntriesForGeneral":[{"_id":"6153519e03385c0016b84e94","troopEntries":[{"_id":"6153519e03385c0016b84e95","troopTypeCode":"LFT","dismountTypeCode":null,"note":null}]}],"allyOptions":[{"_id":"6153519e03385c0016b84e96","dateRange":{"_id":"6153519e03385c0016b84e97","startDate":-2200,"endDate":-2001},"note":null,"allyEntries":[{"_id":"6153519e03385c0016b84e98","name":"Subject Syrian city allies: Note! Going beyond end date of Early Syrian is deliberate","allyArmyList":"6153518d03385c0016b83535"}]},{"_id":"6153519e03385c0016b84e99","dateRange":{"_id":"6153519e03385c0016b84e9a","startDate":-2025,"endDate":-2001},"note":null,"allyEntries":[{"_id":"6153519e03385c0016b84e9b","name":"Subject Mesopotamian city allies","allyArmyList":"6153518d03385c0016b834d0"}]},{"_id":"6153519e03385c0016b84e9c","dateRange":{"_id":"6153519e03385c0016b84e9d","startDate":-2025,"endDate":-2001},"note":null,"allyEntries":[{"_id":"6153519e03385c0016b84e9e","name":"Subject Mesopotamian city allies","allyArmyList":"6153518d03385c0016b834c1"}]}],"battleCardEntries":[{"_id":"6153519e03385c0016b84e9f","min":null,"max":null,"battleCardCode":"PT","note":"pack donkeys"}],"showTroopOptionDescriptions":true,"status":"Revised","id":"5fb1b9d8e1af0600177092ec"},{"keywords":[],"derivedData":{"listStartDate":-3000,"listEndDate":-2601,"extendedName":"Proto-Elamite  3000 to 2601 BC"},"sortId":8,"sublistId":"a","name":"Proto-Elamite","invasionRatings":[{"_id":"6153507203385c0016b8159d","value":3,"note":null}],"maneuverRatings":[{"_id":"6153507203385c0016b8159e","value":0,"note":null}],"homeTopographies":[{"values":["Dry"],"_id":"6153507203385c0016b8159f","note":""}],"listId":8,"dateRanges":[{"_id":"6153507203385c0016b815a0","startDate":-3000,"endDate":-2601}],"troopOptions":[{"_id":"6153519e03385c0016b84ebb","min":1,"max":1,"dateRanges":[],"troopEntries":[{"_id":"6153519e03385c0016b84ebc","troopTypeCode":"ARC","dismountTypeCode":null,"note":null}],"description":"Retainers","note":"","core":"all","battleCardEntries":[]},{"_id":"6153519e03385c0016b84ebd","min":16,"max":22,"dateRanges":[],"troopEntries":[{"_id":"6153519e03385c0016b84ebe","troopTypeCode":"BLV","dismountTypeCode":null,"note":null}],"description":"Bowmen","note":"","core":"","battleCardEntries":[]}],"troopEntriesForGeneral":[{"_id":"6153519e03385c0016b84ebf","troopEntries":[{"_id":"6153519e03385c0016b84ec0","troopTypeCode":"ARC","dismountTypeCode":null,"note":null}]}],"allyOptions":[{"_id":"6153519e03385c0016b84ec1","dateRange":null,"note":null,"allyEntries":[{"_id":"6153519e03385c0016b84ec2","name":"Zagros Highlander allies","allyArmyList":"6153518d03385c0016b83529"}]}],"battleCardEntries":[{"_id":"6153519e03385c0016b84ec3","min":null,"max":null,"battleCardCode":"PT","note":"pack donkeys"}],"showTroopOptionDescriptions":true,"status":"Revised","id":"5fb1b9d8e1af0600177092fa"},{"keywords":["Anatolian","Highland"],"derivedData":{"listStartDate":-3000,"listEndDate":-950,"extendedName":"Early Bronze Age Highlanders  3000 to 950 BC"},"sortId":9,"sublistId":"e","name":"Early Bronze Age Highlanders","invasionRatings":[{"_id":"6153507203385c0016b815ca","value":3,"note":null}],"maneuverRatings":[{"_id":"6153507203385c0016b815cb","value":1,"note":null}],"homeTopographies":[{"values":["Hilly"],"_id":"6153507203385c0016b815cc","note":""}],"listId":9,"dateRanges":[{"_id":"6153507203385c0016b815cd","startDate":-3000,"endDate":-950}],"troopOptions":[{"_id":"6153519e03385c0016b84f52","min":1,"max":2,"dateRanges":[],"troopEntries":[{"_id":"6153519e03385c0016b84f53","troopTypeCode":"RDR","dismountTypeCode":null,"note":null},{"_id":"6153519e03385c0016b84f54","troopTypeCode":"ARC","dismountTypeCode":null,"note":null}],"description":"Bodyguards","note":"","core":"all","battleCardEntries":[]},{"_id":"6153519e03385c0016b84f55","min":8,"max":20,"dateRanges":[],"troopEntries":[{"_id":"6153519e03385c0016b84f56","troopTypeCode":"RBL","dismountTypeCode":null,"note":null}],"description":"Unshielded javelinmen","note":"","core":"","battleCardEntries":[]},{"_id":"6153519e03385c0016b84f57","min":0,"max":3,"dateRanges":[{"_id":"6153519e03385c0016b84f58","startDate":-1500,"endDate":-950}],"troopEntries":[{"_id":"6153519e03385c0016b84f59","troopTypeCode":"LFT","dismountTypeCode":null,"note":null}],"description":"Javelinmen with shields","note":"","core":"all","battleCardEntries":[]},{"_id":"6153519e03385c0016b84f5a","min":4,"max":12,"dateRanges":[],"troopEntries":[{"_id":"6153519e03385c0016b84f5b","troopTypeCode":"BLV","dismountTypeCode":null,"note":null}],"description":"Bowmen","note":"","core":"","battleCardEntries":[]},{"_id":"6153519e03385c0016b84f5c","min":0,"max":2,"dateRanges":[],"troopEntries":[{"_id":"6153519e03385c0016b84f5d","troopTypeCode":"SKM","dismountTypeCode":null,"note":null}],"description":"Slingers","note":"","core":"","battleCardEntries":[]}],"troopEntriesForGeneral":[{"_id":"6153519e03385c0016b84f5e","troopEntries":[{"_id":"6153519e03385c0016b84f5f","troopTypeCode":"RDR","dismountTypeCode":null,"note":null},{"_id":"6153519e03385c0016b84f60","troopTypeCode":"ARC","dismountTypeCode":null,"note":null}]}],"allyOptions":[],"battleCardEntries":[{"_id":"6153519e03385c0016b84f61","min":null,"max":null,"battleCardCode":"PT","note":"pack donkeys"}],"showTroopOptionDescriptions":true,"status":"Revised","id":"5fb1b9d9e1af060017709327"}]