[{"keywords":["American"],"derivedData":{"listStartDate":-899,"listEndDate":-400,"extendedName":"Early Nomadic Meso-American  899 to 400 BC"},"sortId":343,"sublistId":"b","name":"Early Nomadic Meso-American","invasionRatings":[{"_id":"6153508e03385c0016b82612","value":2,"note":null}],"maneuverRatings":[{"_id":"6153508e03385c0016b82613","value":2,"note":null}],"homeTopographies":[{"values":["Forest"," Hilly"],"_id":"6153508e03385c0016b82614","note":""}],"listId":911,"dateRanges":[{"_id":"6153508e03385c0016b82615","startDate":-899,"endDate":-400}],"troopOptions":[{"_id":"615351b603385c0016b88d6d","min":0,"max":2,"dateRanges":[],"troopEntries":[{"_id":"615351b603385c0016b88d6e","troopTypeCode":"LFT","dismountTypeCode":null,"note":null}],"description":"Well equipped or trained infantry","note":"","core":"all","battleCardEntries":[]},{"_id":"615351b603385c0016b88d6f","min":11,"max":16,"dateRanges":[],"troopEntries":[{"_id":"615351b603385c0016b88d70","troopTypeCode":"SKM","dismountTypeCode":null,"note":null}],"description":"Hit-and-run unshielded fighters armed with substantial melee weapons","note":"","core":"","battleCardEntries":[]},{"_id":"615351b603385c0016b88d71","min":0,"max":4,"dateRanges":[],"troopEntries":[{"_id":"615351b603385c0016b88d72","troopTypeCode":"RBL","dismountTypeCode":null,"note":null}],"description":"Poorly-armed skirmishing foot","note":"","core":"","battleCardEntries":[]}],"troopEntriesForGeneral":[{"_id":"615351b603385c0016b88d73","troopEntries":[{"_id":"615351b603385c0016b88d74","troopTypeCode":"LFT","dismountTypeCode":null,"note":null}]},{"_id":"615351b603385c0016b88d75","troopEntries":[{"_id":"615351b603385c0016b88d76","troopTypeCode":"RBL","dismountTypeCode":null,"note":null}]}],"allyOptions":[],"battleCardEntries":[],"showTroopOptionDescriptions":true,"status":"Revised","id":"5fb1b9f5e1af06001770a38c"},{"keywords":["American"],"derivedData":{"listStartDate":-600,"listEndDate":950,"extendedName":"Minor Mexican City-States  600 BC to 950 AD"},"sortId":344,"sublistId":"a","name":"Minor Mexican City-States","invasionRatings":[{"_id":"6153508e03385c0016b82619","value":1,"note":null}],"maneuverRatings":[{"_id":"6153508e03385c0016b8261a","value":0,"note":null}],"homeTopographies":[{"values":["Hilly"],"_id":"6153508e03385c0016b8261b","note":""}],"listId":912,"dateRanges":[{"_id":"6153508e03385c0016b8261c","startDate":-600,"endDate":950}],"troopOptions":[{"_id":"615351b603385c0016b88d77","min":8,"max":16,"dateRanges":[],"troopEntries":[{"_id":"615351b603385c0016b88d78","troopTypeCode":"HFT","dismountTypeCode":null,"note":null}],"description":"Nobles armed with long spears and large shields","note":"","core":"all","battleCardEntries":[]},{"_id":"615351b603385c0016b88d79","min":0,"max":6,"dateRanges":[],"troopEntries":[{"_id":"615351b603385c0016b88d7a","troopTypeCode":"HRD","dismountTypeCode":null,"note":null}],"description":"Poorly-armed commoners","note":"","core":"","battleCardEntries":[]},{"_id":"615351b603385c0016b88d7b","min":0,"max":4,"dateRanges":[],"troopEntries":[{"_id":"615351b603385c0016b88d7c","troopTypeCode":"SKM","dismountTypeCode":null,"note":null}],"description":"Peasant skirmishing slingers","note":"","core":"","battleCardEntries":[]}],"troopEntriesForGeneral":[{"_id":"615351b603385c0016b88d7d","troopEntries":[{"_id":"615351b603385c0016b88d7e","troopTypeCode":"HFT","dismountTypeCode":null,"note":null}]}],"allyOptions":[],"battleCardEntries":[],"showTroopOptionDescriptions":true,"status":"Revised","id":"5fb1b9f5e1af06001770a393"},{"keywords":["American"],"derivedData":{"listStartDate":-500,"listEndDate":1100,"extendedName":"Oaxaca  500 BC to 1100 AD"},"sortId":345,"sublistId":"a","name":"Oaxaca","invasionRatings":[{"_id":"6153508e03385c0016b82620","value":2,"note":null}],"maneuverRatings":[{"_id":"6153508e03385c0016b82621","value":2,"note":"1 BC-200 AD"},{"_id":"6153508e03385c0016b82622","value":0,"note":"651-1100 AD"},{"_id":"6153508e03385c0016b82623","value":1,"note":"Otherwise"}],"homeTopographies":[{"values":["Hilly"],"_id":"6153508e03385c0016b82624","note":""}],"listId":913,"dateRanges":[{"_id":"6153508e03385c0016b82625","startDate":-500,"endDate":1100}],"troopOptions":[{"_id":"615351b603385c0016b88d7f","min":8,"max":16,"dateRanges":[],"troopEntries":[{"_id":"615351b603385c0016b88d80","troopTypeCode":"LSP","dismountTypeCode":null,"note":null}],"description":"Nobles armed with long spears and clubs or small shields","note":"","core":"all","battleCardEntries":[]},{"_id":"615351b603385c0016b88d81","min":0,"max":2,"dateRanges":[],"troopEntries":[{"_id":"615351b603385c0016b88d82","troopTypeCode":"RDR","dismountTypeCode":null,"note":null}],"description":"Suit-wearers armed with long spears and clubs or small shields","note":"","core":"","battleCardEntries":[]},{"_id":"615351b603385c0016b88d83","min":0,"max":2,"dateRanges":[],"troopEntries":[{"_id":"615351b603385c0016b88d84","troopTypeCode":"LFT","dismountTypeCode":null,"note":null}],"description":"Garrison troops armed with mixed weapons","note":"","core":"","battleCardEntries":[]},{"_id":"615351b603385c0016b88d85","min":0,"max":6,"dateRanges":[],"troopEntries":[{"_id":"615351b603385c0016b88d86","troopTypeCode":"HRD","dismountTypeCode":null,"note":null}],"description":"Poorly-armed commoners","note":"","core":"","battleCardEntries":[]},{"_id":"615351b603385c0016b88d87","min":0,"max":4,"dateRanges":[],"troopEntries":[{"_id":"615351b603385c0016b88d88","troopTypeCode":"SKM","dismountTypeCode":null,"note":null}],"description":"Peasant skirmishing slingers","note":"","core":"","battleCardEntries":[]}],"troopEntriesForGeneral":[{"_id":"615351b603385c0016b88d89","troopEntries":[{"_id":"615351b603385c0016b88d8a","troopTypeCode":"LSP","dismountTypeCode":null,"note":null}]}],"allyOptions":[],"battleCardEntries":[],"showTroopOptionDescriptions":true,"status":"Revised","id":"5fb1b9f5e1af06001770a39a"},{"keywords":["American"],"derivedData":{"listStartDate":-1150,"listEndDate":-400,"extendedName":"Olmec  1150 to 400 BC"},"sortId":342,"sublistId":"a","name":"Olmec","invasionRatings":[{"_id":"6153508e03385c0016b82604","value":4,"note":null}],"maneuverRatings":[{"_id":"6153508e03385c0016b82605","value":1,"note":null}],"homeTopographies":[{"values":["Forest"],"_id":"6153508e03385c0016b82606","note":""}],"listId":910,"dateRanges":[{"_id":"6153508e03385c0016b82607","startDate":-1150,"endDate":-400}],"troopOptions":[{"_id":"615351b603385c0016b88d5c","min":0,"max":2,"dateRanges":[],"troopEntries":[{"_id":"615351b603385c0016b88d5d","troopTypeCode":"HFT","dismountTypeCode":null,"note":null}],"description":"Warrior societies","note":"","core":"all","battleCardEntries":[]},{"_id":"615351b603385c0016b88d5e","min":8,"max":16,"dateRanges":[],"troopEntries":[{"_id":"615351b603385c0016b88d5f","troopTypeCode":"HFT","dismountTypeCode":null,"note":null}],"description":"Fighters armed with spears and clubs","note":"","core":"","battleCardEntries":[]},{"_id":"615351b603385c0016b88d60","min":2,"max":6,"dateRanges":[{"_id":"615351b603385c0016b88d61","startDate":-899,"endDate":-400}],"troopEntries":[{"_id":"615351b603385c0016b88d62","troopTypeCode":"SKM","dismountTypeCode":null,"note":null}],"description":"Skirmishing slingers","note":"","core":"","battleCardEntries":[]}],"troopEntriesForGeneral":[{"_id":"615351b603385c0016b88d63","troopEntries":[{"_id":"615351b603385c0016b88d64","troopTypeCode":"HFT","dismountTypeCode":null,"note":null}]}],"allyOptions":[],"battleCardEntries":[],"showTroopOptionDescriptions":true,"status":"Revised","id":"5fb1b9f4e1af06001770a37e"},{"keywords":["American"],"derivedData":{"listStartDate":-1150,"listEndDate":-400,"extendedName":"Early Settled Meso-American  1150 to 400 BC"},"sortId":343,"sublistId":"a","name":"Early Settled Meso-American","invasionRatings":[{"_id":"6153508e03385c0016b8260b","value":1,"note":null}],"maneuverRatings":[{"_id":"6153508e03385c0016b8260c","value":1,"note":null}],"homeTopographies":[{"values":["Forest"," Hilly"],"_id":"6153508e03385c0016b8260d","note":""}],"listId":911,"dateRanges":[{"_id":"6153508e03385c0016b8260e","startDate":-1150,"endDate":-400}],"troopOptions":[{"_id":"615351b603385c0016b88d65","min":0,"max":2,"dateRanges":[],"troopEntries":[{"_id":"615351b603385c0016b88d66","troopTypeCode":"LFT","dismountTypeCode":null,"note":null}],"description":"Well equipped or trained infantry","note":"","core":"all","battleCardEntries":[]},{"_id":"615351b603385c0016b88d67","min":21,"max":24,"dateRanges":[],"troopEntries":[{"_id":"615351b603385c0016b88d68","troopTypeCode":"RBL","dismountTypeCode":null,"note":null}],"description":"Untrained tribesmen and poorly armed skirmishers","note":"","core":"","battleCardEntries":[]}],"troopEntriesForGeneral":[{"_id":"615351b603385c0016b88d69","troopEntries":[{"_id":"615351b603385c0016b88d6a","troopTypeCode":"LFT","dismountTypeCode":null,"note":null}]},{"_id":"615351b603385c0016b88d6b","troopEntries":[{"_id":"615351b603385c0016b88d6c","troopTypeCode":"RBL","dismountTypeCode":null,"note":null}]}],"allyOptions":[],"battleCardEntries":[],"showTroopOptionDescriptions":true,"status":"Revised","id":"5fb1b9f5e1af06001770a385"}]