[{"keywords":[],"derivedData":{"listStartDate":-2600,"listEndDate":-2101,"extendedName":"Awan Dynasty Elamite  2600 to 2101 BC"},"sortId":8,"sublistId":"b","name":"Awan Dynasty Elamite","invasionRatings":[{"_id":"6153507203385c0016b815a3","value":3,"note":null}],"maneuverRatings":[{"_id":"6153507203385c0016b815a4","value":1,"note":null}],"homeTopographies":[{"values":["Dry"],"_id":"6153507203385c0016b815a5","note":""}],"listId":8,"dateRanges":[{"_id":"6153507203385c0016b815a6","startDate":-2600,"endDate":-2101}],"troopOptions":[{"_id":"6153519e03385c0016b84ec4","min":1,"max":1,"dateRanges":[],"troopEntries":[{"_id":"6153519e03385c0016b84ec5","troopTypeCode":"ARC","dismountTypeCode":null,"note":null},{"_id":"6153519e03385c0016b84ec6","troopTypeCode":"LSP","dismountTypeCode":null,"note":null},{"_id":"6153519e03385c0016b84ec7","troopTypeCode":"RDR","dismountTypeCode":null,"note":null}],"description":"Retainers","note":"","core":"all","battleCardEntries":[]},{"_id":"6153519e03385c0016b84ec8","min":0,"max":1,"dateRanges":[],"troopEntries":[{"_id":"6153519e03385c0016b84ec9","troopTypeCode":"BTX","dismountTypeCode":null,"note":null}],"description":"4-wheeled battle platforms","note":"","core":"","battleCardEntries":[]},{"_id":"6153519e03385c0016b84eca","min":0,"max":2,"dateRanges":[],"troopEntries":[{"_id":"6153519e03385c0016b84ecb","troopTypeCode":"PIK","dismountTypeCode":null,"note":null}],"description":"Household spearmen","note":"","core":"all","battleCardEntries":[]},{"_id":"6153519e03385c0016b84ecc","min":14,"max":22,"dateRanges":[],"troopEntries":[{"_id":"6153519e03385c0016b84ecd","troopTypeCode":"BLV","dismountTypeCode":null,"note":null}],"description":"Bowmen","note":"","core":"","battleCardEntries":[]}],"troopEntriesForGeneral":[{"_id":"6153519e03385c0016b84ece","troopEntries":[{"_id":"6153519e03385c0016b84ecf","troopTypeCode":"BTX","dismountTypeCode":null,"note":null},{"_id":"6153519e03385c0016b84ed0","troopTypeCode":"ARC","dismountTypeCode":null,"note":null},{"_id":"6153519e03385c0016b84ed1","troopTypeCode":"RDR","dismountTypeCode":null,"note":null},{"_id":"6153519e03385c0016b84ed2","troopTypeCode":"LSP","dismountTypeCode":null,"note":null}]}],"allyOptions":[{"_id":"6153519e03385c0016b84ed3","dateRange":null,"note":null,"allyEntries":[{"_id":"6153519e03385c0016b84ed4","name":"Zagros Highlander allies","allyArmyList":"6153518d03385c0016b83529"}]}],"battleCardEntries":[{"_id":"6153519e03385c0016b84ed5","min":null,"max":null,"battleCardCode":"PT","note":"pack donkeys"}],"showTroopOptionDescriptions":true,"status":"Revised","id":"5fb1b9d8e1af060017709300"},{"keywords":["Elamite"],"derivedData":{"listStartDate":-2100,"listEndDate":-1401,"extendedName":"Early Elam  2100 to 1401 BC"},"sortId":8,"sublistId":"c","name":"Early Elam","invasionRatings":[{"_id":"6153507203385c0016b815a9","value":3,"note":null}],"maneuverRatings":[{"_id":"6153507203385c0016b815aa","value":1,"note":null}],"homeTopographies":[{"values":["Dry"],"_id":"6153507203385c0016b815ab","note":""}],"listId":8,"dateRanges":[{"_id":"6153507203385c0016b815ac","startDate":-2100,"endDate":-1401}],"troopOptions":[{"_id":"6153519e03385c0016b84ed6","min":1,"max":3,"dateRanges":[],"troopEntries":[{"_id":"6153519e03385c0016b84ed7","troopTypeCode":"ARC","dismountTypeCode":null,"note":null},{"_id":"6153519e03385c0016b84ed8","troopTypeCode":"RDR","dismountTypeCode":null,"note":null}],"description":"Retainers","note":"","core":"all","battleCardEntries":[]},{"_id":"6153519e03385c0016b84ed9","min":0,"max":1,"dateRanges":[],"troopEntries":[{"_id":"6153519e03385c0016b84eda","troopTypeCode":"BTX","dismountTypeCode":null,"note":null}],"description":"4-wheeled battle platforms or straddle cars","note":"","core":"all","battleCardEntries":[]},{"_id":"6153519e03385c0016b84edb","min":9,"max":22,"dateRanges":[],"troopEntries":[{"_id":"6153519e03385c0016b84edc","troopTypeCode":"BLV","dismountTypeCode":null,"note":null}],"description":"Bowmen","note":"","core":"","battleCardEntries":[]}],"troopEntriesForGeneral":[{"_id":"6153519e03385c0016b84edd","troopEntries":[{"_id":"6153519e03385c0016b84ede","troopTypeCode":"BTX","dismountTypeCode":null,"note":null},{"_id":"6153519e03385c0016b84edf","troopTypeCode":"ARC","dismountTypeCode":null,"note":null},{"_id":"6153519e03385c0016b84ee0","troopTypeCode":"RDR","dismountTypeCode":null,"note":null}]}],"allyOptions":[{"_id":"6153519e03385c0016b84ee1","dateRange":null,"note":null,"allyEntries":[{"_id":"6153519e03385c0016b84ee2","name":"Zagros Highlander allies","allyArmyList":"6153518d03385c0016b83529"}]},{"_id":"6153519e03385c0016b84ee3","dateRange":{"_id":"6153519e03385c0016b84ee4","startDate":-2100,"endDate":-1850},"note":null,"allyEntries":[{"_id":"6153519e03385c0016b84ee5","name":"Amurru allies","allyArmyList":"6153518d03385c0016b834ec"}]},{"_id":"6153519e03385c0016b84ee6","dateRange":{"_id":"6153519e03385c0016b84ee7","startDate":-2100,"endDate":-1850},"note":null,"allyEntries":[{"_id":"6153519e03385c0016b84ee8","name":"Melukhkhan allies","allyArmyList":"6153518d03385c0016b834b8"}]},{"_id":"6153519e03385c0016b84ee9","dateRange":{"_id":"6153519e03385c0016b84eea","startDate":-1769,"endDate":-1769},"note":null,"allyEntries":[{"_id":"6153519e03385c0016b84eeb","name":"Mari or Babylonian allies","allyArmyList":"6153518e03385c0016b83563"}]},{"_id":"6153519e03385c0016b84eec","dateRange":{"_id":"6153519e03385c0016b84eed","startDate":-1768,"endDate":-1768},"note":null,"allyEntries":[{"_id":"6153519e03385c0016b84eee","name":"Eshnunnan vassal allies","allyArmyList":"6153518d03385c0016b834c1"}]},{"_id":"6153519e03385c0016b84eef","dateRange":{"_id":"6153519e03385c0016b84ef0","startDate":-1764,"endDate":-1764},"note":null,"allyEntries":[{"_id":"6153519e03385c0016b84ef1","name":"Assyrian allies","allyArmyList":"6153518e03385c0016b83563"}]},{"_id":"6153519e03385c0016b84ef2","dateRange":{"_id":"6153519e03385c0016b84ef3","startDate":-1764,"endDate":-1764},"note":null,"allyEntries":[{"_id":"6153519e03385c0016b84ef4","name":"Malgi (Amurru) allies","allyArmyList":"6153518d03385c0016b834ec"}]},{"_id":"6153519e03385c0016b84ef5","dateRange":{"_id":"6153519e03385c0016b84ef6","startDate":-2100,"endDate":-1850},"note":null,"allyEntries":[{"_id":"6153519e03385c0016b84ef7","name":"Melukhkhan allies","allyArmyList":"6153518d03385c0016b834b8"},{"_id":"6153519e03385c0016b84ef8","name":"Amurru allies","allyArmyList":"6153518d03385c0016b834ec"}]}],"battleCardEntries":[{"_id":"6153519e03385c0016b84ef9","min":null,"max":null,"battleCardCode":"PT","note":"pack donkeys"}],"showTroopOptionDescriptions":true,"status":"Revised","id":"5fb1b9d8e1af060017709306"},{"keywords":["Elamite"],"derivedData":{"listStartDate":-1400,"listEndDate":-800,"extendedName":"Middle Elam  1400 to 800 BC"},"sortId":8,"sublistId":"d","name":"Middle Elam","invasionRatings":[{"_id":"6153507203385c0016b815b0","value":3,"note":null}],"maneuverRatings":[{"_id":"6153507203385c0016b815b1","value":1,"note":null}],"homeTopographies":[{"values":["Dry"],"_id":"6153507203385c0016b815b2","note":""}],"listId":8,"dateRanges":[{"_id":"6153507203385c0016b815b3","startDate":-1400,"endDate":-800}],"troopOptions":[{"_id":"6153519e03385c0016b84efa","min":1,"max":2,"dateRanges":[],"troopEntries":[{"_id":"6153519e03385c0016b84efb","troopTypeCode":"CHT","dismountTypeCode":null,"note":null}],"description":"2-horse chariots","note":"","core":"","battleCardEntries":[]},{"_id":"6153519e03385c0016b84efc","min":14,"max":22,"dateRanges":[],"troopEntries":[{"_id":"6153519e03385c0016b84efd","troopTypeCode":"BLV","dismountTypeCode":null,"note":null}],"description":"Bowmen","note":"","core":"all","battleCardEntries":[]}],"troopEntriesForGeneral":[{"_id":"6153519e03385c0016b84efe","troopEntries":[{"_id":"6153519e03385c0016b84eff","troopTypeCode":"CHT","dismountTypeCode":null,"note":null}]}],"allyOptions":[{"_id":"6153519e03385c0016b84f00","dateRange":null,"note":null,"allyEntries":[{"_id":"6153519e03385c0016b84f01","name":"Zagros Highlander allies","allyArmyList":"6153518d03385c0016b83529"}]}],"battleCardEntries":[{"_id":"6153519e03385c0016b84f02","min":null,"max":null,"battleCardCode":"PT","note":"pack donkeys"}],"showTroopOptionDescriptions":true,"status":"Revised","id":"5fb1b9d9e1af06001770930d"}]