[{"keywords":["Maluche"],"derivedData":{"listStartDate":1461,"listEndDate":1552,"extendedName":"Araucanian  1461 to 1552 AD"},"sortId":365,"sublistId":"b","name":"Araucanian","invasionRatings":[{"_id":"6153508f03385c0016b82707","value":0,"note":null}],"maneuverRatings":[{"_id":"6153508f03385c0016b82708","value":1,"note":null}],"homeTopographies":[{"values":["Arable"],"_id":"6153508f03385c0016b82709","note":""}],"listId":355,"dateRanges":[{"_id":"6153508f03385c0016b8270a","startDate":1461,"endDate":1552}],"troopOptions":[{"_id":"615351b703385c0016b88f0f","min":8,"max":16,"dateRanges":[],"troopEntries":[{"_id":"615351b703385c0016b88f10","troopTypeCode":"LSP","dismountTypeCode":null,"note":null}],"description":"Tribesmen armed with long spears","note":"","core":"all","battleCardEntries":[]},{"_id":"615351b703385c0016b88f11","min":0,"max":8,"dateRanges":[],"troopEntries":[{"_id":"615351b703385c0016b88f12","troopTypeCode":"SKM","dismountTypeCode":null,"note":null}],"description":"Skirmishing bowmen","note":"","core":"","battleCardEntries":[]},{"_id":"615351b703385c0016b88f13","min":0,"max":2,"dateRanges":[],"troopEntries":[{"_id":"615351b703385c0016b88f14","troopTypeCode":"SKM","dismountTypeCode":null,"note":null}],"description":"Skirmishing slingers","note":"","core":"","battleCardEntries":[]}],"troopEntriesForGeneral":[{"_id":"615351b703385c0016b88f15","troopEntries":[{"_id":"615351b703385c0016b88f16","troopTypeCode":"LSP","dismountTypeCode":null,"note":null}]}],"allyOptions":[],"battleCardEntries":[],"showTroopOptionDescriptions":true,"status":"Revised","id":"5fb1b9f6e1af06001770a490"},{"keywords":[],"derivedData":{"listStartDate":1438,"listEndDate":1534,"extendedName":"Inca  1438 to 1534 AD"},"sortId":364,"sublistId":"a","name":"Inca","invasionRatings":[{"_id":"6153508f03385c0016b826f4","value":2,"note":null}],"maneuverRatings":[{"_id":"6153508f03385c0016b826f5","value":3,"note":"1438-1469 AD"},{"_id":"6153508f03385c0016b826f6","value":2,"note":"1470-1534 AD"}],"homeTopographies":[{"values":["Hilly"," Dry"],"_id":"6153508f03385c0016b826f7","note":""}],"listId":354,"dateRanges":[{"_id":"6153508f03385c0016b826f8","startDate":1438,"endDate":1534}],"troopOptions":[{"_id":"615351b703385c0016b88ee4","min":1,"max":1,"dateRanges":[],"troopEntries":[{"_id":"615351b703385c0016b88ee5","troopTypeCode":"RDR","dismountTypeCode":null,"note":null}],"description":"Inca noble bodyguard","note":"","core":"all","battleCardEntries":[]},{"_id":"615351b703385c0016b88ee6","min":3,"max":10,"dateRanges":[],"troopEntries":[{"_id":"615351b703385c0016b88ee7","troopTypeCode":"LFT","dismountTypeCode":null,"note":null}],"description":"Inca Huaminca regulars","note":"","core":"all","battleCardEntries":[]},{"_id":"615351b703385c0016b88ee8","min":4,"max":8,"dateRanges":[],"troopEntries":[{"_id":"615351b703385c0016b88ee9","troopTypeCode":"SKM","dismountTypeCode":null,"note":null}],"description":"Skirmishing slingers","note":"","core":"","battleCardEntries":[]},{"_id":"615351b703385c0016b88eea","min":2,"max":12,"dateRanges":[{"_id":"615351b703385c0016b88eeb","startDate":1469,"endDate":1534}],"troopEntries":[{"_id":"615351b703385c0016b88eec","troopTypeCode":"RBL","dismountTypeCode":null,"note":null}],"description":"Quechua and Aymara military mita","note":"","core":"","battleCardEntries":[]},{"_id":"615351b703385c0016b88eed","min":0,"max":1,"dateRanges":[{"_id":"615351b703385c0016b88eee","startDate":1476,"endDate":1534}],"troopEntries":[{"_id":"615351b703385c0016b88eef","troopTypeCode":"RDR","dismountTypeCode":null,"note":null}],"description":"Coastal Peruvian nobles","note":"","core":"all","battleCardEntries":[]}],"troopEntriesForGeneral":[{"_id":"615351b703385c0016b88ef0","troopEntries":[{"_id":"615351b703385c0016b88ef1","troopTypeCode":"RDR","dismountTypeCode":null,"note":null}]}],"allyOptions":[{"_id":"615351b703385c0016b88ef2","dateRange":{"_id":"615351b703385c0016b88ef3","startDate":1438,"endDate":1468},"note":null,"allyEntries":[{"_id":"615351b703385c0016b88ef4","name":"Quechua or Aymara allies","allyArmyList":"6153519d03385c0016b84d09"}]},{"_id":"615351b703385c0016b88ef5","dateRange":{"_id":"615351b703385c0016b88ef6","startDate":1440,"endDate":1462},"note":null,"allyEntries":[{"_id":"615351b703385c0016b88ef7","name":"Chanca allies","allyArmyList":"6153519d03385c0016b84d03"}]},{"_id":"615351b703385c0016b88ef8","dateRange":{"_id":"615351b703385c0016b88ef9","startDate":1469,"endDate":1475},"note":null,"allyEntries":[{"_id":"615351b703385c0016b88efa","name":"Peruvian coastal allies","allyArmyList":"6153519d03385c0016b84cff"}]}],"battleCardEntries":[{"_id":"615351b703385c0016b88efb","min":null,"max":null,"battleCardCode":"PT","note":"porters or pack llamas"}],"showTroopOptionDescriptions":true,"status":"Revised","id":"5fb1b9f6e1af06001770a47d"},{"keywords":[],"derivedData":{"listStartDate":1461,"listEndDate":1552,"extendedName":"Mapuche  1461 to 1552 AD"},"sortId":365,"sublistId":"a","name":"Mapuche","invasionRatings":[{"_id":"6153508f03385c0016b82701","value":0,"note":null}],"maneuverRatings":[{"_id":"6153508f03385c0016b82702","value":1,"note":null}],"homeTopographies":[{"values":["Arable"],"_id":"6153508f03385c0016b82703","note":""}],"listId":355,"dateRanges":[{"_id":"6153508f03385c0016b82704","startDate":1461,"endDate":1552}],"troopOptions":[{"_id":"615351b703385c0016b88f07","min":8,"max":16,"dateRanges":[],"troopEntries":[{"_id":"615351b703385c0016b88f08","troopTypeCode":"LFT","dismountTypeCode":null,"note":null}],"description":"Tribesmen","note":"","core":"all","battleCardEntries":[]},{"_id":"615351b703385c0016b88f09","min":0,"max":8,"dateRanges":[],"troopEntries":[{"_id":"615351b703385c0016b88f0a","troopTypeCode":"ARC","dismountTypeCode":null,"note":null}],"description":"Bowmen","note":"","core":"","battleCardEntries":[]},{"_id":"615351b703385c0016b88f0b","min":0,"max":2,"dateRanges":[],"troopEntries":[{"_id":"615351b703385c0016b88f0c","troopTypeCode":"SKM","dismountTypeCode":null,"note":null}],"description":"Skirmishing slingers","note":"","core":"","battleCardEntries":[]}],"troopEntriesForGeneral":[{"_id":"615351b703385c0016b88f0d","troopEntries":[{"_id":"615351b703385c0016b88f0e","troopTypeCode":"LFT","dismountTypeCode":null,"note":null}]}],"allyOptions":[],"battleCardEntries":[],"showTroopOptionDescriptions":true,"status":"Revised","id":"5fb1b9f6e1af06001770a48a"}]